<?xml version="1.0" encoding="ISO-8859-1"?>
<!DOCTYPE xtiny-doc SYSTEM "../dtd/xtiny-doc.dtd" >

<!--
  -
  - Jext documentation source document
  - Based on xtiny-doc DTD
  -
  - DTD:xtiny-doc and XSL:xtiny-doc
  - are (C)1999 Romain Guy
  -
  - Last updated: 09/30/2001 - 23:10:38
  -
  -->

<xtiny-doc author="Romain Guy"
           name=""
           version=""
           copyright="Jext est sous copyright (C)2001 Romain Guy. Distribué selon les termes de la licence GPL-2."
           email="romain.guy@jext.org"
           url="http://www.jext.org"
           title="Documentation de Jext"
           update="09/30/2001">

  <img src="../jext.gif" width="480" height="200" alt="Jext" />

  <paragraph title="Remerciements">
    Je souhaiterais remercier chaleureusement les personnes qui ont contribué à Jext en offrant leur code source ou
    leurs idées: <b>Slava Pestov</b> et <b>Mike Dillon</b> (pour leurs nombreuses parties de Jext),
    <b>Aaron Miller</b> (pour son support, son aide pour corriger la documentation, son plugin CodeMaster
    et son aide pour maintenir Jext), <b>Matthew Allbrecht</b> (pour avoir écrit les deux premiers plugins pour
    Jext et ses améliorations sur FastTyper), <b>Scott Bellamy</b>
    (pour ses idées, son aide et son plugin d'impression), <b>Matthew Benson</b> (correctifs et améliorations),
    <b>Bogdan Mitu</b> (association plugins/modes), <b>Steve Lawson</b> (amélioration de la barre de boutons),
    <b>Benoit Rigaud &amp; Cyril Legrand</b> (écrans de démarrage), <b>Blake Winton</b> (idée des modèles),
    <b>Scott Wyatt and Barranger Ridler</b> (support de la molette de souris), <b>Ian D. Stewart</b>
    (cache des boites de dialogue), <b>Grant Stead</b> (Bureaux XML) et <b>Julien Ponge</b> (mémoire).
  </paragraph>

  <paragraph title="Dépendances">
    Jext pourra être exécuté sur toute machine virtuelle Java supportant au moins les spécifications Java2.
  </paragraph>
  <paragraph>
    Jext est livré avec plusieurs scripts de démarrage destinés à divers systèmes d'exploitation.
    Sous Un*x, utilisez jext, sous NetWare, jext.ncf. Sous Windows jext.exe, jext.js, ou jext.bat.
  </paragraph>

  <paragraph title="Présentation">
    Jext est un puissant éditeur écrit en pur Java, particulièrement adapté aux programmeurs.
    Pour cette raison, Jext offre de nombreuses fonctions pour aider à programmer: coloration syntaxique,
    auto indentation, navigateur de code, navigateur de classes, une console interne... Les utilisateurs
    plus classiques ne seront pas en reste avec les autres possibilités de Jext. Parmi celle-ci, nous
    retrouvons l'édition HTML, l'envoi de mails, un langage de scripting et une librairie de modèles.
    Enfin, Jext est entièrement configurable grâce aux plugins, aux scripts et ses multiples options.
  </paragraph>
  <paragraph>
    Jext contient une multitude de raccourcis qui vous aidront à améliorer votre productivité. Après avoir
    lu cette documentation, vous devriez être en mesure de tirer pleinement parti des capacités de ce
    logiciel..
  </paragraph>

  <sections-list title="Sections">
    <section name="Menus" target="jext-menus.html" />
      <sections-list>
        <section name="Fichier" target="jext-menus-file.html" />
        <section name="Edition" target="jext-menus-edit.html" />
        <section name="Recherche" target="jext-menus-search.html" />
        <section name="Outils" target="jext-menus-tools.html" />
        <section name="Plugins" target="jext-menus-plugins.html" />
        <section name="Jext" target="jext-menus-jext.html" />
      </sections-list>
    <section name="Editeur" target="jext-editor.html" />
    <section name="Rechercher et Remplacer" target="jext-search.html" />
    <section name="Console" target="jext-console.html" />
    <section name="XInsert" target="jext-xinsert.html" />
    <section name="Bureaux" target="jext-workspaces.html" />
    <section name="Favoris" target="jext-vf.html" />
    <section name="Options" target="jext-options.html" />
    <section name="Modèles" target="jext-templates.html" />
    <section name="Scripts" target="jext-scripts.html" />
    <section name="Plugins" target="jext-plugins.html" />
  </sections-list>
</xtiny-doc>

<!-- End of Jext documentation -->
